{
  "$schema": "http://json-schema.org/draft-07/schema#",
  "definitions": {
    "mapPosition": {
      "type": "object",
      "additionalProperties": false,
      "required": ["x", "y"],
      "properties": {
        "x": { "type": "number", "minimum": 0 },
        "y": { "type": "number", "minimum": 0 }
      }
    }
  },
  "title": "Linear cutscene source",
  "type": "object",
  "additionalProperties": false,
  "required": [
    "$schema",
    "formatVersion",
    "id",
    "mapId",
    "sequence",
    "allowSkip",
    "onComplete"
  ],
  "properties": {
    "$schema": {
      "type": "string",
      "minLength": 1
    },
    "formatVersion": {
      "type": "integer",
      "enum": [
        1
      ]
    },
    "id": {
      "type": "string",
      "pattern": "^[^\\s:]+:[^\\s]+$"
    },
    "mapId": {
      "type": "string",
      "pattern": "\\S"
    },
    "sequence": {
      "type": "array",
      "minItems": 1,
      "items": {
        "type": "object",
        "additionalProperties": false,
        "required": [
          "id",
          "action",
          "arguments"
        ],
        "properties": {
          "id": {
            "type": "string",
            "pattern": "\\S"
          },
          "action": {
            "type": "string",
            "pattern": "\\S"
          },
          "arguments": {
            "type": "object",
            "additionalProperties": {
              "oneOf": [
                {
                  "type": "string",
                  "pattern": "\\S"
                },
                {
                  "type": "number"
                },
                {
                  "$ref": "#/definitions/mapPosition"
                }
              ]
            }
          }
        }
      }
    },
    "allowSkip": {
      "type": "boolean"
    },
    "onComplete": {
      "type": "object",
      "additionalProperties": false,
      "required": [
        "actorPlacements",
        "actions"
      ],
      "properties": {
        "actorPlacements": {
          "type": "array",
          "items": {
            "type": "object",
            "additionalProperties": false,
            "required": [
              "actor",
              "anchor"
            ],
            "properties": {
              "actor": {
                "type": "string",
                "pattern": "\\S"
              },
              "anchor": {
                "type": "string",
                "pattern": "\\S"
              }
            }
          }
        },
        "actions": {
          "type": "string"
        },
        "steps": {
          "type": "array",
          "items": { "$ref": "#/properties/sequence/items" }
        }
      }
    },
    "onStart": {
      "type": "array",
      "items": {
        "type": "object",
        "additionalProperties": false,
        "required": [
          "id",
          "action",
          "arguments"
        ],
        "properties": {
          "id": {
            "type": "string",
            "pattern": "\\S"
          },
          "action": {
            "type": "string",
            "pattern": "\\S"
          },
          "arguments": {
            "type": "object",
            "additionalProperties": {
              "oneOf": [
                {
                  "type": "string",
                  "pattern": "\\S"
                },
                {
                  "type": "number"
                },
                {
                  "$ref": "#/definitions/mapPosition"
                }
              ]
            }
          }
        }
      }
    }
  }
}
